{
  "project": "GSK",
  "note": "Background backlog that makes the GSK board look like an active team. Not part of the scripted demo (seed.json, GSK-1..GSK-6). No trigger labels (devin, devin-backlog, devin-abap, rd-support). 'In Review' is not a status in the GSK workflow: those issues are In Progress with label in-review. The project has no story points field; 'points' is kept here for reference.",
  "issues": [
    {
      "ref": "E-BOOT2",
      "type": "Epic",
      "summary": "ATLAS 2.x / WebAPI Spring Boot 2 upgrade readiness",
      "status": "In Progress",
      "priority": "High",
      "labels": [
        "webapi",
        "tech-debt"
      ],
      "assignee": null,
      "description": "Get WebAPI ready to move from Spring Boot 1.5 / Java 8 to Spring Boot 2.x and Java 11 without changing behaviour.\nBoot 1.5 is out of support, and every later dependency, ATLAS release and hosting change assumes Boot 2.\n\nScope: inventory of Boot 1.5 auto-configuration, Jersey and Shiro wiring, Flyway 4.2 history, Hikari settings and Java 11 build. Out of scope: the Boot 2 cut-over itself and dependency CVE remediation (tracked separately).\n\nExit criteria:\nAC1 Every Boot 1.5-specific property and auto-config used by WebAPI is listed with its Boot 2 equivalent.\nAC2 CI builds and tests WebAPI on Java 8 and Java 11.\nAC3 Flyway history validates on a copy of the production schema with the target Flyway version."
    },
    {
      "ref": "E-VOCAB",
      "type": "Epic",
      "summary": "OMOP CDM v5.4 vocabulary refresh",
      "status": "In Progress",
      "priority": "High",
      "labels": [
        "webapi",
        "vocabulary"
      ],
      "assignee": null,
      "description": "Move ATLAS/WebAPI sources from the CDM v5.3 vocabulary to the CDM v5.4 Athena release used by the R&D data platform.\nResearchers need current SNOMED, RxNorm and LOINC content, and new studies are specified against v5.4 concepts.\n\nScope: load and validate the new vocabulary, concept set resolution changes in ConceptSetService, per-source vocabulary version display and an impact report on saved cohort definitions.\n\nExit criteria:\nAC1 All production sources report the new vocabulary version in /source/sources.\nAC2 Cohort definitions that reference deprecated or remapped concepts are listed with owners.\nAC3 Vocabulary refresh change record approved."
    },
    {
      "ref": "E-P11",
      "type": "Epic",
      "summary": "Audit trail and 21 CFR Part 11 hardening",
      "status": "In Progress",
      "priority": "Highest",
      "labels": [
        "webapi",
        "gxp",
        "security"
      ],
      "assignee": null,
      "description": "Strengthen WebAPI audit trail, session and signature controls so it meets GSK's 21 CFR Part 11 expectations for a silver-tier application.\nToday AuditTrailService writes to a log file only, so QA cannot show a complete, tamper-evident record of who changed a cohort definition and when.\n\nScope: persisted audit events, audit export for QA, JWT session limits, re-authentication before publishing, URS and traceability updates in validation/.\n\nExit criteria:\nAC1 Create/update/delete of cohort definitions and concept sets produce persisted audit events with user, timestamp and before/after hash.\nAC2 QA can export the audit trail for a date range without database access.\nAC3 URS delta, traceability rows and change record approved by the named GSK approver."
    },
    {
      "ref": "E-S4",
      "type": "Epic",
      "summary": "SAP custom-code S/4 readiness (abap2xlsx consumers)",
      "status": "In Progress",
      "priority": "Medium",
      "labels": [
        "abap",
        "s4hana",
        "tech-debt"
      ],
      "assignee": null,
      "description": "Make sure GSK's ECC Z-programs that build or read Excel through abap2xlsx keep working after the S/4HANA move.\nFinance and supply reports depend on ZCL_EXCEL_WRITER_2007 and ZCL_EXCEL_READER_2007, and some callers use APIs that are not released for clean core.\n\nScope: inventory of abap2xlsx consumers, clean-core replacements for unreleased APIs, reader/writer defects found during readiness analysis. Analysis and source fixes only; no Basis work or conversion.\n\nExit criteria:\nAC1 Every consumer Z-program is rated for S/4 simplification and clean-core risk.\nAC2 High-risk calls have a released-API replacement or an accepted exemption.\nAC3 abaplint stays at 0 issues."
    },
    {
      "ref": "S-BOOTINV",
      "type": "Story",
      "summary": "Inventory Boot 1.5 auto-configuration, Jersey and Shiro wiring for the Boot 2 move",
      "parent": "E-BOOT2",
      "status": "Done",
      "priority": "High",
      "labels": [
        "webapi",
        "tech-debt"
      ],
      "points": 5,
      "assignee": "ciaran.deasy@cognition.ai",
      "description": "List every Spring Boot 1.5 auto-configuration, property and starter WebAPI relies on, including JerseyConfig and ShiroConfiguration.\nThe Boot 2 migration can only be estimated once we know exactly which behaviours change underneath us.\n\nAcceptance criteria:\nAC1 docs/boot2-inventory.md lists each starter, auto-config class and application.properties key with its Boot 2 name or removal note.\nAC2 JerseyConfig, ShiroConfiguration, FlywayConfig and DataAccessConfig are each covered with the beans they define.\nAC3 Items that need code change (not just a property rename) are tagged and sized.",
      "comment": "Inventory merged. 41 properties rename cleanly, 6 need code changes (mostly ShiroConfiguration filter registration and the Jersey servlet path). Sized the follow-ups on the Epic."
    },
    {
      "ref": "S-HIKARI",
      "type": "Story",
      "summary": "Size Hikari pool per source and expose pool metrics over JMX",
      "parent": "E-BOOT2",
      "status": "In Progress",
      "priority": "High",
      "labels": [
        "webapi",
        "performance"
      ],
      "points": 3,
      "assignee": "ciaran.deasy@cognition.ai",
      "description": "Tune the spring.datasource.hikari.* settings for the WebAPI schema and each CDM source, and publish pool usage metrics.\nPool sizing is a single default today, so a busy CDM source can starve the WebAPI schema and we cannot see it happening.\n\nAcceptance criteria:\nAC1 maximum-pool-size, minimum-idle and connection-timeout are set per environment in the profile, with the reasoning documented.\nAC2 Active, idle and pending connection counts are visible over JMX (register-mbeans) and on the WebAPI Grafana dashboard.\nAC3 Load test with 20 concurrent generations shows no connection-timeout errors.",
      "comment": "Pool MBeans are registered in dev. Load test at 20 concurrent generations peaks at 14 active connections; proposing max 24 / min idle 4 for prod."
    },
    {
      "ref": "S-FLYWAY",
      "type": "Story",
      "summary": "Flyway 4.2 to 6.x path: baseline checksums for existing schema history",
      "parent": "E-BOOT2",
      "status": "To Do",
      "priority": "Medium",
      "labels": [
        "webapi",
        "tech-debt"
      ],
      "points": 8,
      "assignee": null,
      "description": "Prove that the existing flyway_schema_history in the WebAPI schema validates under the Flyway version Boot 2 brings in.\nFlyway 5+ changes the history table name and checksum handling, and a failed validate on start-up would take ATLAS down.\n\nAcceptance criteria:\nAC1 Migration from schema_version to flyway_schema_history is scripted and tested on a copy of the production schema.\nAC2 flyway validate passes on that copy with validateOnMigrate=true.\nAC3 Rollback steps are written up in validation/rollback/."
    },
    {
      "ref": "S-JAVA11",
      "type": "Story",
      "summary": "Build and test WebAPI on Java 11 in CI alongside Java 8",
      "parent": "E-BOOT2",
      "status": "In Review",
      "priority": "Medium",
      "labels": [
        "webapi",
        "tech-debt",
        "in-review"
      ],
      "points": 3,
      "assignee": "ciaran.deasy@cognition.ai",
      "description": "Add a Java 11 leg to the CI workflow so build and tests run on both JDKs for every PR.\nBoot 2 work needs early warning of Java 11 incompatibilities instead of finding them in one big-bang branch.\n\nAcceptance criteria:\nAC1 ci.yml runs build and tests on Java 8 and Java 11 with the webapi-postgresql profile.\nAC2 The Java 11 leg is required once it has been green for five consecutive main builds.\nAC3 Known Java 11 failures are listed as follow-up tickets, not skipped silently.",
      "comment": "PR is up. Java 11 leg is green except two JAXB-related test classes; raised follow-ups rather than skipping them."
    },
    {
      "ref": "B-HIKARILEAK",
      "type": "Bug",
      "summary": "Hikari connections leak when an estimation execution is cancelled",
      "parent": "E-BOOT2",
      "status": "In Progress",
      "priority": "Highest",
      "labels": [
        "webapi",
        "performance"
      ],
      "points": 5,
      "assignee": "ciaran.deasy@cognition.ai",
      "description": "Cancelling a running estimation or prediction execution leaves its JDBC connection checked out of the Hikari pool.\nAfter a handful of cancels the pool is exhausted and every WebAPI request waits for connection-timeout.\n\nSteps to reproduce:\n1. Start an estimation execution against a CDM source.\n2. Cancel it from the Executions tab while the SQL step is running.\n3. Repeat until the number of cancels equals maximum-pool-size.\n4. Call GET /WebAPI/info: it times out after connection-timeout.\n\nAcceptance criteria:\nAC1 Cancelling an execution returns its connection to the pool within 5 seconds.\nAC2 Hikari leak detection reports no leaks for the cancel path in the integration test.\nAC3 Regression test covers cancel during the SQL step and during the R step.",